"StaffID","StaffUsername","StaffPassword","StaffName","StaffPosition","StaffPTJ","StaffOfficeNo","StaffPhoneNo"
"S01","Hazmi","hazmi00","Muhammad Nazierul Hazmi bin Rozian","Lecturer","Human Resources","+603-87872808","010-9087765"
"S02","Atika","atika00","Noor Atika Izwani binti Izhar","Lecturer","Human Resources ","+603-87872800","013-3791220"
"S03","Fatin ","fatin00","Fatin Amira binti Mohd Fadzir","Technician ","Faculty of Information and Communication Technology","+603-96962020","014-4569908"
"S04","Intan","intan00","Intan Syuhadah binti Ishak","Technician ","Faculty of Manufacturing Engineering ","+603-2234506","017-8764353"
"S05","Fatin Azwani","fatin00","Fatin Azwani binti Abu Bakar ","Lecturer","Faculty of Technical Engineering ","+603-86542030","012-5672323"
"S06","Ilya ","ilya00","Ilya Yasmine binti Ahmad Syukri","Technician","Faculty of Information Technology and Communication ","+603-9966554","010-7894532"
